{
  "schema_version": 1,
  "observation_id": "2026-10-13-worker_proof_authority_inputs",
  "recorded_at": "2026-10-13T17:42:57-07:00",
  "source_references": [
    "pm/plans/in_progress/2026-10-13-campaign-restart-acceptance/plan.md"
  ],
  "context": {
    "languages": [
      "typescript"
    ],
    "frameworks": [],
    "components": [
      "rolling-worker",
      "rolling-campaign-store"
    ],
    "affected_boundaries": [
      "worker evidence to accepted certificate"
    ],
    "code_references": [
      "src/rolling-worker.ts",
      "src/rolling-campaign-store.ts:1678",
      "skills/plan-execution/scripts/obligations.ts:499"
    ]
  },
  "observed_behavior": "Original workers included the coordinator accepted obligation document in evidence for focused QA that did not consume that document, making the retained proof impossible to certify.",
  "expected_behavior": "Evidence binds changed candidate artifacts and genuine QA inputs; frozen leases retain coordinator authority separately. Artifact freshness does not imply automated prose testing.",
  "causal_mechanism": "Instructions requested relevant tracked inputs without distinguishing authority-only reads from QA-consumed inputs. Certificate assessment correctly requires all QA inputs and rejects self-certifying accepted-state bytes.",
  "anti_pattern": {
    "structural_description": "An operational evidence instruction leaves the provenance boundary between authority and QA consumption ambiguous.",
    "why_it_fails": "A worker can overstate QA inputs and introduce a self-reference that immutable certificate assessment cannot accept."
  },
  "correct_pattern": {
    "required_invariant": "Evidence covers changed candidate artifacts and actual QA inputs while excluding authority-only reads; changed reports retain Git freshness coverage.",
    "implementation_description": "Instructions state both input roles, exclude authority-only state reads and require reporting incompatible genuine QA consumption. Existing changed-artifact freshness validation remains intact."
  },
  "applicability_conditions": [
    "Workers read mutable coordinator authority that their recorded QA command does not consume."
  ],
  "known_non_matches": [
    "A genuinely consumed input must remain in evidence even when certificate scope is incompatible."
  ],
  "confirmation_evidence": [
    "GWEN original worker101 and107 submissions included obligations.json authority reads in structural QA evidence.",
    "Source certificateReasons requires evidence-input coverage and acceptIncrementCertificates rejects accepted-document self-coverage.",
    "A command-consumed-only clarification was rejected for missing changed report inputs; the consumer regression proves changed-report inclusion is required and accepted without an automated prose-testing claim."
  ],
  "regression_proofs": [
    "tests/rolling-worker.test.ts: worker instructions retain exact obligation, requirement, acceptance step, lease and QA selections",
    "tests/rolling-worker-submission.test.ts: changed assessment reports bind candidate freshness without claiming automated prose testing"
  ]
}
